{
  "schema_version": "0.1",
  "code": {
    "n": 5,
    "generators": [
      "XZZXI",
      "IXZZX",
      "XIXZZ",
      "ZXIXZ"
    ],
    "name": "Five-qubit perfect code"
  },
  "code_input_hash": "9161ef2d00f50c84d5d6f9b79623c1ea1b0d016a19b649c649b08169dfdd6d31",
  "software_version": "0.1.0",
  "software_git_commit": null,
  "seed": 20261003,
  "configuration": {
    "budget": 24,
    "max_weight": 2,
    "max_combinations": 500000,
    "beam_width": 12,
    "idles": false,
    "required_distance": 2
  },
  "fault_model": "independent Pauli faults at distinct circuit locations; ideal initial and final syndrome boundaries",
  "candidates_evaluated": 24,
  "rejections": {},
  "stage_outcomes": {
    "C_logical_witness": 24
  },
  "frontier": [
    {
      "architecture_id": "f1a4596800cfe2771f8d",
      "candidate": {
        "generating_basis": [
          "XZZXI",
          "IXZZX",
          "XIXZZ",
          "ZXIXZ"
        ],
        "orders": [
          [
            0,
            1,
            2,
            3
          ],
          [
            1,
            2,
            3,
            4
          ],
          [
            0,
            2,
            3,
            4
          ],
          [
            0,
            1,
            3,
            4
          ]
        ],
        "flag_intervals": [
          [],
          [],
          [],
          []
        ],
        "check_order": [
          0,
          1,
          2,
          3
        ],
        "ancilla_assignment": [
          0,
          0,
          0,
          0
        ],
        "syndrome_budget": 1,
        "parallelism": 1
      },
      "resources": {
        "data_qubits": 5,
        "syndrome_ancillas": 1,
        "flag_ancillas": 0,
        "Q": 6,
        "one_q_gates": 8,
        "two_q_gates": 16,
        "measurements": 4,
        "resets": 4,
        "preparations": 0,
        "operation_count": 32,
        "D": 32,
        "QD": 192,
        "depth_lower_bound": 32,
        "schedule_efficiency": 1.0
      },
      "bounds": {
        "status": "EXACT",
        "lower_bound": 2,
        "upper_bound": 2,
        "excluded_through": 1,
        "witness": {
          "fault_count": 2,
          "faults": [
            {
              "operation": 2,
              "qubits": [
                5,
                0
              ],
              "label": "IY",
              "kind": "cx",
              "location": "op:2",
              "before": false
            },
            {
              "operation": 20,
              "qubits": [
                5,
                3
              ],
              "label": "YY",
              "kind": "cz",
              "location": "op:20",
              "before": false
            }
          ],
          "checks": [
            0,
            2
          ],
          "relation": "cross-check",
          "hook_support": [
            0,
            3,
            4
          ],
          "flags_fired": false,
          "flag_information_cancelled": false,
          "logical_coset": 2,
          "detector_outcomes": 0,
          "flag_outcomes": 0,
          "final_data_pauli": "YIIYZ"
        },
        "reason": null,
        "combinations_examined": 571,
        "fault_locations": 32,
        "fault_variants": 280,
        "requested_weight": 2
      },
      "stage": "C",
      "rejection": null,
      "signature_seconds": 0.026140999980270863,
      "screening_stop": "C_logical_witness",
      "fault_search_seconds": 0.0005185999907553196,
      "runtime_seconds": 0.027366199996322393
    },
    {
      "architecture_id": "298192c4d2e14693f4a0",
      "candidate": {
        "generating_basis": [
          "XZZXI",
          "IXZZX",
          "XIXZZ",
          "ZXIXZ"
        ],
        "orders": [
          [
            2,
            0,
            1,
            3
          ],
          [
            1,
            3,
            2,
            4
          ],
          [
            4,
            2,
            3,
            0
          ],
          [
            0,
            3,
            1,
            4
          ]
        ],
        "flag_intervals": [
          [
            [
              0,
              1
            ]
          ],
          [],
          [],
          [
            [
              3,
              4
            ]
          ]
        ],
        "check_order": [
          0,
          2,
          3,
          1
        ],
        "ancilla_assignment": [
          0,
          1,
          2,
          3
        ],
        "syndrome_budget": 4,
        "parallelism": 2
      },
      "resources": {
        "data_qubits": 5,
        "syndrome_ancillas": 4,
        "flag_ancillas": 2,
        "Q": 11,
        "one_q_gates": 8,
        "two_q_gates": 20,
        "measurements": 6,
        "resets": 6,
        "preparations": 0,
        "operation_count": 40,
        "D": 24,
        "QD": 264,
        "depth_lower_bound": 24,
        "schedule_efficiency": 1.0
      },
      "bounds": {
        "status": "EXACT",
        "lower_bound": 2,
        "upper_bound": 2,
        "excluded_through": 1,
        "witness": {
          "fault_count": 2,
          "faults": [
            {
              "operation": 4,
              "qubits": [
                5,
                2
              ],
              "label": "IX",
              "kind": "cz",
              "location": "op:4",
              "before": false
            },
            {
              "operation": 23,
              "qubits": [
                8,
                3
              ],
              "label": "XI",
              "kind": "cx",
              "location": "op:23",
              "before": false
            }
          ],
          "checks": [
            0,
            3
          ],
          "relation": "cross-check",
          "hook_support": [
            1,
            2,
            4
          ],
          "flags_fired": false,
          "flag_information_cancelled": false,
          "logical_coset": 2,
          "detector_outcomes": 0,
          "flag_outcomes": 0,
          "final_data_pauli": "IXXIZ"
        },
        "reason": null,
        "combinations_examined": 915,
        "fault_locations": 40,
        "fault_variants": 348,
        "requested_weight": 2
      },
      "stage": "C",
      "rejection": null,
      "signature_seconds": 0.040160599979572,
      "screening_stop": "C_logical_witness",
      "fault_search_seconds": 0.0006662999512627721,
      "runtime_seconds": 0.04166410001926124
    }
  ],
  "exploratory_frontier": [
    {
      "architecture_id": "f1a4596800cfe2771f8d",
      "candidate": {
        "generating_basis": [
          "XZZXI",
          "IXZZX",
          "XIXZZ",
          "ZXIXZ"
        ],
        "orders": [
          [
            0,
            1,
            2,
            3
          ],
          [
            1,
            2,
            3,
            4
          ],
          [
            0,
            2,
            3,
            4
          ],
          [
            0,
            1,
            3,
            4
          ]
        ],
        "flag_intervals": [
          [],
          [],
          [],
          []
        ],
        "check_order": [
          0,
          1,
          2,
          3
        ],
        "ancilla_assignment": [
          0,
          0,
          0,
          0
        ],
        "syndrome_budget": 1,
        "parallelism": 1
      },
      "resources": {
        "data_qubits": 5,
        "syndrome_ancillas": 1,
        "flag_ancillas": 0,
        "Q": 6,
        "one_q_gates": 8,
        "two_q_gates": 16,
        "measurements": 4,
        "resets": 4,
        "preparations": 0,
        "operation_count": 32,
        "D": 32,
        "QD": 192,
        "depth_lower_bound": 32,
        "schedule_efficiency": 1.0
      },
      "bounds": {
        "status": "EXACT",
        "lower_bound": 2,
        "upper_bound": 2,
        "excluded_through": 1,
        "witness": {
          "fault_count": 2,
          "faults": [
            {
              "operation": 2,
              "qubits": [
                5,
                0
              ],
              "label": "IY",
              "kind": "cx",
              "location": "op:2",
              "before": false
            },
            {
              "operation": 20,
              "qubits": [
                5,
                3
              ],
              "label": "YY",
              "kind": "cz",
              "location": "op:20",
              "before": false
            }
          ],
          "checks": [
            0,
            2
          ],
          "relation": "cross-check",
          "hook_support": [
            0,
            3,
            4
          ],
          "flags_fired": false,
          "flag_information_cancelled": false,
          "logical_coset": 2,
          "detector_outcomes": 0,
          "flag_outcomes": 0,
          "final_data_pauli": "YIIYZ"
        },
        "reason": null,
        "combinations_examined": 571,
        "fault_locations": 32,
        "fault_variants": 280,
        "requested_weight": 2
      },
      "stage": "C",
      "rejection": null,
      "signature_seconds": 0.026140999980270863,
      "screening_stop": "C_logical_witness",
      "fault_search_seconds": 0.0005185999907553196,
      "runtime_seconds": 0.027366199996322393
    },
    {
      "architecture_id": "298192c4d2e14693f4a0",
      "candidate": {